{
  "$schema": "https://json-schema.org/draft/2020-12/schema",
  "$id": "https://contracts.bairui.ai/v2/release-manifest.schema.json",
  "title": "ReleaseManifest",
  "type": "object",
  "additionalProperties": false,
  "required": [
    "schema_version",
    "organization_id",
    "user_id",
    "agent_id",
    "server_id",
    "request_id",
    "correlation_id",
    "idempotency_key",
    "created_at",
    "revision",
    "sequence",
    "signature",
    "release_id",
    "version",
    "channel",
    "status",
    "contracts_version",
    "agent_commit",
    "artifacts",
    "compatibility",
    "immutable"
  ],
  "properties": {
    "schema_version": {
      "const": "1.0"
    },
    "organization_id": {
      "type": "string",
      "pattern": "^[A-Za-z0-9][A-Za-z0-9._:/-]{0,255}$"
    },
    "user_id": {
      "type": "string",
      "pattern": "^[A-Za-z0-9][A-Za-z0-9._:/-]{0,255}$"
    },
    "agent_id": {
      "type": "string",
      "pattern": "^[A-Za-z0-9][A-Za-z0-9._:/-]{0,255}$"
    },
    "server_id": {
      "type": "string",
      "pattern": "^[A-Za-z0-9][A-Za-z0-9._:/-]{0,255}$"
    },
    "request_id": {
      "type": "string",
      "pattern": "^[A-Za-z0-9][A-Za-z0-9._:/-]{0,255}$"
    },
    "correlation_id": {
      "type": "string",
      "pattern": "^[A-Za-z0-9][A-Za-z0-9._:/-]{0,255}$"
    },
    "idempotency_key": {
      "type": "string",
      "pattern": "^[A-Za-z0-9][A-Za-z0-9._:/-]{0,255}$"
    },
    "created_at": {
      "type": "string",
      "format": "date-time"
    },
    "revision": {
      "type": "integer",
      "minimum": 1
    },
    "sequence": {
      "type": "integer",
      "minimum": 1
    },
    "signature": {
      "type": "object",
      "additionalProperties": false,
      "required": [
        "algorithm",
        "key_id",
        "value",
        "signed_at"
      ],
      "properties": {
        "algorithm": {
          "enum": [
            "ed25519",
            "hmac-sha256"
          ]
        },
        "key_id": {
          "type": "string",
          "pattern": "^[A-Za-z0-9][A-Za-z0-9._:/-]{0,255}$"
        },
        "value": {
          "type": "string",
          "pattern": "^[A-Za-z0-9+/=_-]{16,2048}$"
        },
        "signed_at": {
          "type": "string",
          "format": "date-time"
        }
      }
    },
    "release_id": {
      "type": "string",
      "pattern": "^[A-Za-z0-9][A-Za-z0-9._:/-]{0,255}$"
    },
    "version": {
      "type": "string",
      "pattern": "^[0-9]+\\.[0-9]+\\.[0-9]+(?:-[0-9A-Za-z.-]+)?$",
      "maxLength": 64
    },
    "channel": {
      "enum": [
        "prerelease",
        "stable"
      ]
    },
    "status": {
      "enum": [
        "candidate",
        "approved",
        "rolling_out",
        "released",
        "blocked",
        "withdrawn"
      ]
    },
    "contracts_version": {
      "type": "string",
      "pattern": "^[0-9]+\\.[0-9]+\\.[0-9]+(?:-[0-9A-Za-z.-]+)?$",
      "maxLength": 64
    },
    "immutable": {
      "const": true
    },
    "agent_commit": {
      "type": "string",
      "pattern": "^[a-f0-9]{40}$"
    },
    "artifacts": {
      "type": "array",
      "minItems": 1,
      "maxItems": 100,
      "items": {
        "type": "object",
        "additionalProperties": false,
        "required": [
          "component",
          "version",
          "ref",
          "digest"
        ],
        "properties": {
          "component": {
            "enum": [
              "platform",
              "agent",
              "control",
              "channel",
              "database",
              "proxy",
              "other"
            ]
          },
          "version": {
            "type": "string",
            "pattern": "^[0-9]+\\.[0-9]+\\.[0-9]+(?:-[0-9A-Za-z.-]+)?$",
            "maxLength": 64
          },
          "ref": {
            "type": "string",
            "pattern": "^(?:ref|id|hint):[A-Za-z0-9][A-Za-z0-9._:/-]{0,255}$"
          },
          "digest": {
            "type": "string",
            "pattern": "^sha256:[a-f0-9]{64}$"
          },
          "sbom_ref": {
            "type": "string",
            "pattern": "^(?:ref|id|hint):[A-Za-z0-9][A-Za-z0-9._:/-]{0,255}$"
          },
          "provenance_ref": {
            "type": "string",
            "pattern": "^(?:ref|id|hint):[A-Za-z0-9][A-Za-z0-9._:/-]{0,255}$"
          }
        }
      }
    },
    "sbom_ref": {
      "type": "string",
      "pattern": "^(?:ref|id|hint):[A-Za-z0-9][A-Za-z0-9._:/-]{0,255}$"
    },
    "provenance_ref": {
      "type": "string",
      "pattern": "^(?:ref|id|hint):[A-Za-z0-9][A-Za-z0-9._:/-]{0,255}$"
    },
    "attestation_ref": {
      "type": "string",
      "pattern": "^(?:ref|id|hint):[A-Za-z0-9][A-Za-z0-9._:/-]{0,255}$"
    },
    "migration_ref": {
      "type": "string",
      "pattern": "^(?:ref|id|hint):[A-Za-z0-9][A-Za-z0-9._:/-]{0,255}$"
    },
    "compatibility": {
      "type": "object",
      "additionalProperties": false,
      "required": [
        "contracts_min"
      ],
      "properties": {
        "contracts_min": {
          "type": "string",
          "pattern": "^[0-9]+\\.[0-9]+\\.[0-9]+(?:-[0-9A-Za-z.-]+)?$",
          "maxLength": 64
        },
        "contracts_max": {
          "type": "string",
          "pattern": "^[0-9]+\\.[0-9]+\\.[0-9]+(?:-[0-9A-Za-z.-]+)?$",
          "maxLength": 64
        },
        "agent_min": {
          "type": "string",
          "pattern": "^[0-9]+\\.[0-9]+\\.[0-9]+(?:-[0-9A-Za-z.-]+)?$",
          "maxLength": 64
        },
        "platform_min": {
          "type": "string",
          "pattern": "^[0-9]+\\.[0-9]+\\.[0-9]+(?:-[0-9A-Za-z.-]+)?$",
          "maxLength": 64
        },
        "rollback_release_id": {
          "type": "string",
          "pattern": "^[A-Za-z0-9][A-Za-z0-9._:/-]{0,255}$"
        },
        "required_capabilities": {
          "type": "array",
          "maxItems": 100,
          "uniqueItems": true,
          "items": {
            "type": "string",
            "pattern": "^[A-Za-z0-9][A-Za-z0-9._:/-]{0,255}$"
          }
        }
      }
    },
    "release_notes_ref": {
      "type": "string",
      "pattern": "^(?:ref|id|hint):[A-Za-z0-9][A-Za-z0-9._:/-]{0,255}$"
    }
  }
}
