{
  "schema_version": "1.0",
  "organization_id": "org_1",
  "user_id": "user_1",
  "agent_id": "agent_1",
  "server_id": "server_1",
  "request_id": "req_release_1",
  "correlation_id": "corr_control_1",
  "idempotency_key": "idem_release_1",
  "created_at": "2026-07-18T00:04:00Z",
  "revision": 1,
  "sequence": 5,
  "signature": {
    "algorithm": "ed25519",
    "key_id": "key_1",
    "value": "EEEEEEEEEEEEEEEEEEEEEEEEEEEEEEEEEEEEEEEEEEEEEEEEEEEEEE==",
    "signed_at": "2026-07-18T00:04:01Z"
  },
  "release_id": "release_1",
  "version": "2.3.0-rc.1",
  "channel": "prerelease",
  "status": "candidate",
  "contracts_version": "2.3.0-rc.1",
  "immutable": true,
  "agent_commit": "0123456789abcdef0123456789abcdef01234567",
  "artifacts": [
    {
      "component": "agent",
      "version": "2.3.0-rc.1",
      "ref": "ref:agent-image",
      "digest": "sha256:bbbbbbbbbbbbbbbbbbbbbbbbbbbbbbbbbbbbbbbbbbbbbbbbbbbbbbbbbbbbbbbb",
      "sbom_ref": "ref:agent-sbom",
      "provenance_ref": "ref:agent-provenance"
    }
  ],
  "sbom_ref": "ref:release-sbom",
  "provenance_ref": "ref:release-provenance",
  "attestation_ref": "ref:release-attestation",
  "migration_ref": "ref:control-revision-1",
  "compatibility": {
    "contracts_min": "2.2.1",
    "agent_min": "2.3.0-rc.1",
    "platform_min": "2.3.0-rc.1",
    "required_capabilities": ["control.events", "control.leases"]
  },
  "release_notes_ref": "ref:release-notes-1"
}
